{"battery":{"case_count":9,"contract":"ai/composition-battery-contract.json","contract_sha256":"ec79687f2acc72f466e32aa79c4f00ffa12f1b8b075b90ebbe9bd9202bf07dea","index":"batteries/index.json","index_sha256":"8526b026b0fb53eb600fcac1ab31d400a75733f6a167d12cb438522372668056","version":"0.3.0"},"case_results":[{"battery":"capability_invention","id":"INT-BAT-008","observed":{"decision":"reject","failure_code":"INT_CAPABILITY_INVENTION","invented_capabilities":["teleport_semantic_state"]},"result":"pass"},{"battery":"conflict_preservation","id":"INT-BAT-003","observed":{"decision":"allow","failure_code":null},"result":"pass"},{"battery":"cross_mode_boundary","id":"INT-BAT-005","observed":{"decision":"block","failure_code":"INT_CROSS_MODE_BRIDGE_REQUIRED"},"result":"pass"},{"battery":"perfect_hash_does_not_increase_evidence_strength","id":"INT-BAT-007","observed":{"decision":"allow","failure_code":null},"result":"pass"},{"battery":"provenance_retention","id":"INT-BAT-001","observed":{"decision":"allow","failure_code":null},"result":"pass"},{"battery":"recovery_without_authority_escalation","id":"INT-BAT-006","observed":{"decision":"allow","failure_code":null},"result":"pass"},{"battery":"satire_register_preservation","id":"INT-BAT-004","observed":{"decision":"allow","failure_code":null},"result":"pass"},{"battery":"stale_parent","id":"INT-BAT-009","observed":{"compatibility":"untested","failure_code":"INT_PARENT_FRESHNESS_UNTESTED","requires_review":true},"result":"pass"},{"battery":"unknown_preservation","id":"INT-BAT-002","observed":{"decision":"allow","failure_code":null},"result":"pass"}],"compatibility":"compatible","fingerprint_sha256":"12e4bb013f6994f45110e46f7d2fe2f1cfd813ef0d35e5eacffb901cfe091942","live_parent_freshness":"untested","parents":{"ark":{"artifacts":[{"git_blob_sha1":"1a4860543488357321e1aad24ce36266769c5f39","path":"ai/minimum-recoverable-substrate.json"},{"git_blob_sha1":"dc7ea8e37772e677ee09f0e3a1447c2700a74789","path":"ai/recovery-tiers.json"},{"git_blob_sha1":"9016cf8e6641d48e639fb69cd5ad7f98a02840b7","path":"manifest.json"}],"pinned_commit":"f2bbf149abb3f8ccbfed158176873d813b66b546","protocol":"QSOL-ARK","repository":"https://github.com/QSOLKCB/QSOL-ARK"},"substrate":{"artifacts":[{"git_blob_sha1":"6abd254957843f2a0d42066423a5689099f85b6c","path":"ai/epistemic-contract.json"},{"git_blob_sha1":"bdc57ae303c2ce5b8498e3867d15d1804a59ba30","path":"ai/manifest.json"},{"git_blob_sha1":"9c830b095f59bbd948bf9ea5a8b35127121a7d99","path":"ai/mode-contract.json"}],"pinned_commit":"60e8cfeefa859df375f9f4d2fdb735edb1249db8","protocol":"QSOL-SUBSTRATE","repository":"https://github.com/QSOLKCB/QSOL-SUBSTRATE"}},"protocol":"QSOL-INT","scope":"pinned_parent_evidence_only","summary":{"failed":0,"passed":9,"requires_live_drift_check_for_current_parent_claim":true},"type":"qsol-int-compatibility-report","version":"0.3.0"}
